<?xml version="1.0"?>

<!DOCTYPE myMessage SYSTEM "mobilec.dtd">

<MOBILEC_MESSAGE>
 <MESSAGE message="MOBILE_AGENT">
  <MOBILE_AGENT>
   <AGENT_DATA>
    <NAME>squad_leader</NAME>
    <OWNER>IEL</OWNER>
    <HOME>localhost:5050</HOME>
    <TASKS task="3" num="0">
      <TASK  num="0"
             complete="0" 
             server="localhost:5051">
      </TASK>
      <TASK  num="1"
             complete="0" 
             server="localhost:5052">
      </TASK>
      <TASK  num="2"
             complete="0" 
             server="localhost:5053">
      </TASK>

     <AGENT_CODE>
       <![CDATA[
#include <stdio.h>
#define AGENTS_BEGIN 55
#define AGENTS_END 56
#define TASK_BEGIN 57
#define TASK1 58
#define TASK2 59
#define TASK3 60
#define NUM_AGENTS 4
int main() 
{
    mc_BarrierInit(AGENTS_BEGIN, NUM_AGENTS);
    mc_BarrierInit(AGENTS_END, NUM_AGENTS);
    sleep(1);
    if (mc_host_port == 5051) {
        printf("Squad leader at port %d. Setting up barriers.\n",
                mc_host_port);
        mc_Barrier(AGENTS_BEGIN);
        mc_Barrier(AGENTS_END);
    } else if (mc_host_port == 5052) {
        printf("Squad leader at port %d. Setting up barriers.\n",
                mc_host_port);
        mc_Barrier(AGENTS_BEGIN);
        mc_Barrier(AGENTS_END);
    } else if (mc_host_port = 5053) {
        printf("Squad leader at port %d. Setting up barriers.\n",
                mc_host_port);
        mc_BarrierInit(TASK_BEGIN, 3);
        mc_BarrierInit(TASK1, 2);
        mc_BarrierInit(TASK2, 2);
        mc_BarrierInit(TASK3, 2);
        mc_Barrier(AGENTS_BEGIN);
        mc_Barrier(TASK_BEGIN);
        mc_Barrier(AGENTS_END);
    }
    return 0;
}
       ]]>
     </AGENT_CODE>
    </TASKS>
   </AGENT_DATA>
  </MOBILE_AGENT>
 </MESSAGE>
</MOBILEC_MESSAGE>
