<?xml version="1.0"?>

<!DOCTYPE myMessage SYSTEM "mobilec.dtd">
<MOBILEC_MESSAGE>
 <MESSAGE message="MOBILE_AGENT">
  <MOBILE_AGENT>
   <AGENT_DATA>
    <NAME>mobagent2</NAME>
    <OWNER>IEL</OWNER>
    <HOME>10.0.0.11:5050</HOME>
    <TASK task="1" num="0">
     <DATA number_of_elements="0" 
           name="no-return" 
           complete="0" 
           server="10.0.0.15:5050">
     </DATA>
     <AGENT_CODE>
      <![CDATA[
int main() {
  MCAgent_t agent;
   
  agent = mc_FindAgentByName("mobagent1");
  if(agent != NULL) {
    mc_SetAgentStatus(agent, MC_AGENT_NEUTRAL);
  }

  return 0;
}
      ]]>
     </AGENT_CODE>
    </TASK>
   </AGENT_DATA>
  </MOBILE_AGENT>
 </MESSAGE>
</MOBILEC_MESSAGE>
