<?xml version="1.0"?>

<!DOCTYPE myMessage SYSTEM "mobilec.dtd">

<MOBILEC_MESSAGE>
  <MESSAGE message="MOBILE_AGENT">
    <MOBILE_AGENT>
     <AGENT_DATA>
       <NAME>agent1</NAME>
       <OWNER>IEL</OWNER>
       <HOME>localhost:5051</HOME>
       <TASKS task="1" num="0">
        <TASK num="0" complete="0" server="localhost:5050" persistent="1">
        </TASK>
	  <AGENT_CODE>
          <![CDATA[
#include <stdio.h>
#define MC_BARRIER_ID 56

int main()
{
    printf("Agent 1: Approaching Barrier 1...\n");
    mc_Barrier(MC_BARRIER_ID);
    printf("Agent 1: Past Barrier 1.\n");
    sleep( 10 );
    printf("Agent 1: At Barrier 2.\n");
    mc_Barrier(MC_BARRIER_ID + 1);
    printf("Agent 1: Past Barrier 2.\n");
    sleep( 10 );
    printf("Agent 1: At Barrier 3.\n");
    mc_Barrier(MC_BARRIER_ID + 2);
    printf("Agent 1: Past Barrier 3.\n");
    return 0;
}
        ]]>
        </AGENT_CODE>
      </TASKS>
      </AGENT_DATA>
    </MOBILE_AGENT>
  </MESSAGE>
</MOBILEC_MESSAGE>
