<?xml version="1.0"?>

<!DOCTYPE myMessage SYSTEM "mobilec.dtd">

<MOBILEC_MESSAGE>
  <MESSAGE message="MOBILE_AGENT">
    <MOBILE_AGENT>
     <AGENT_DATA>
       <NAME>agent1</NAME>
       <OWNER>IEL</OWNER>
       <HOME>localhost:5050</HOME>
       <TASKS task="1" num="0">
        <TASK num="0" complete="0" server="localhost:5051" persistent="1" >
        </TASK>
	  <AGENT_CODE>
          <![CDATA[
#include <stdio.h>

int main()
{
    int i;
    char** services;
    services = (char**)malloc(sizeof(char*) * 2);
    for (i = 0; i < 2; i++) {
        services[i] = (char*)malloc(sizeof(char)*30);
    }
    strcpy(services[0], "agent1_service");
    strcpy(services[1], "agent1_bonus_service");

    mc_RegisterService(
            mc_current_agent,
            services,
            2
            );

    return 0;
}
        ]]>
        </AGENT_CODE>
      </TASKS>
      </AGENT_DATA>
    </MOBILE_AGENT>
  </MESSAGE>
</MOBILEC_MESSAGE>
