<?xml version="1.0"?>

<!DOCTYPE myMessage SYSTEM "mobilec.dtd">

<MOBILEC_MESSAGE>
 <MESSAGE message="MOBILE_AGENT">
  <MOBILE_AGENT>
   <AGENT_DATA>
    <NAME>retrieval_agent</NAME>
    <OWNER>IEL</OWNER>
    <HOME>localhost:5051</HOME>
    <TASKS task="1" num="0">
     <TASK num="0"complete="0" server="localhost:5052">
     </TASK>
     <AGENT_CODE>
      <![CDATA[
//#include <stdio.h>
#include <math.h>
int retval;
int main()
{
    printf("This is the retrieval agent.\n");
    printf("I am performing the task now.\n");
    retval = hypot(1,2);
    return 0;
}
      ]]>
     </AGENT_CODE>
    </TASKS>
   </AGENT_DATA>
  </MOBILE_AGENT>
 </MESSAGE>
</MOBILEC_MESSAGE>
