<?xml version="1.0"?>

<!DOCTYPE myMessage SYSTEM "mobilec.dtd">

<MOBILEC_MESSAGE>
 <MESSAGE message="MOBILE_AGENT">
  <MOBILE_AGENT>
   <AGENT_DATA>
    <NAME>mobagent1</NAME>
    <OWNER>IEL</OWNER>
    <HOME>169.237.108.153:5051</HOME>
    <TASKS task="1" num="0">
     <TASK num="0" complete="0" server="169.237.108.153:5050">
     </TASK>
     <AGENT_CODE>
      <![CDATA[
#include <stdio.h>
int main() {
  printf("Hello World ... 1 !\n");
  sleep(20);
  return 0;
}
      ]]>
     </AGENT_CODE>
    </TASKS>
   </AGENT_DATA>
  </MOBILE_AGENT>
 </MESSAGE>
</MOBILEC_MESSAGE>
